"DESCRIPTION","DURATION IN MS","NAME","PARENT SUITE","START TIME","STATUS","STOP TIME","SUB SUITE","SUITE","TEST CLASS","TEST METHOD"
"","2205","should login successfully with valid credentials","","Tue Oct 29 21:08:20 WIB 2024","passed","Tue Oct 29 21:08:22 WIB 2024","Login Tests","tests/login.spec.js","",""
"","6840","should complete checkout successfully","","Tue Oct 29 21:08:20 WIB 2024","failed","Tue Oct 29 21:08:27 WIB 2024","Checkout Process Tests","tests/checkout.spec.js","",""
"","2872","Logout and verify redirect to login page","","Tue Oct 29 21:08:20 WIB 2024","passed","Tue Oct 29 21:08:23 WIB 2024","","tests/logout.spec.js","",""
"","1736","should add first product to cart successfully","","Tue Oct 29 21:08:20 WIB 2024","passed","Tue Oct 29 21:08:22 WIB 2024","Product Cart Tests","tests/add-to-cart.spec.js","",""
"","2296","should complete a complex shopping scenario successfully","","Tue Oct 29 21:08:20 WIB 2024","passed","Tue Oct 29 21:08:22 WIB 2024","Advanced Shopping Workflow","tests/advanced-shopping.spec.js","",""
